{
  "id": "abc123",
  "displayName": "example_value",
  "givenName": "example_value",
  "surname": "example_value",
  "mail": "example_value",
  "userPrincipalName": "example_value",
  "mailNickname": "example_value",
  "accountEnabled": true,
  "jobTitle": "example_value",
  "department": "example_value",
  "officeLocation": "example_value",
  "companyName": "example_value",
  "mobilePhone": "example_value",
  "businessPhones": [],
  "streetAddress": "example_value",
  "city": "example_value",
  "state": "example_value",
  "postalCode": "example_value",
  "country": "example_value",
  "usageLocation": "example_value",
  "preferredLanguage": "example_value",
  "userType": "example_value",
  "employeeId": "500123",
  "employeeType": "example_value",
  "employeeHireDate": "example_value",
  "onPremisesSyncEnabled": "example_value",
  "onPremisesSamAccountName": "example_value",
  "proxyAddresses": [],
  "assignedLicenses": [],
  "createdDateTime": "example_value",
  "lastSignInDateTime": "example_value"
}